{
  "schema_version": "controlled-contract-proof-pack-adequacy.experimental.v0.1",
  "profile_id": "proof.lifecycle.bounded-terminal-stability",
  "profile_version": "2.0.0",
  "profile_digest": "2b8bfad7568643427e500fa7ddd777bc544a1d39e70fcd42200ab58b13178cb2",
  "guarantee": "For one declared lifecycle entity, terminal event, terminal state, and explicit bounded horizon, one complete nonempty horizon-scoped observation population records the terminal state for every observation after the terminal event and before the horizon; complete singleton observed-state and terminal-state populations are equal; and one complete in-horizon reactivation-event population has exact cardinality zero.",
  "guarantee_digest": "b5addc399e9e17e3fb2d0445d1e8411655e85dc8c2736fda9e0817b2ec0d8394",
  "required_positive_cases": [
    "credential-revocation",
    "upload-abort",
    "workflow-completion"
  ],
  "required_mutant_kills": [
    "bounded-state-regression",
    "in-horizon-reactivation",
    "observation-outside-bounded-order"
  ],
  "required_profile_rejections": [
    "missing-bounded-read-spine",
    "missing-observation-reads",
    "missing-observation-recording",
    "missing-observations-before-horizon",
    "missing-observed-state-equality",
    "missing-reactivation-verification",
    "missing-state-verification",
    "missing-terminal-before-observations",
    "missing-terminal-entity-link",
    "missing-terminal-state-link",
    "missing-terminal-state-membership",
    "missing-zero-reactivation"
  ],
  "explicit_exclusions": [
    "delivered-evidence-authenticity-or-plan-implementation",
    "dishonest-identity-population-state-event-observation-and-horizon-grounding",
    "forever-after-stability",
    "observations-events-actors-and-resources-outside-declared-populations",
    "post-horizon-behavior",
    "real-time-truth-or-clock-accuracy",
    "transient-state-changes-between-elected-observations"
  ],
  "executable_module": "packages/controlled-contract/test/proof-packs/bounded-terminal-stability-v1-adequacy.mjs",
  "executable_module_digest": "db9369345ca89453e413b7a2d621a03074a2004c0f7cdcb5b0d3558683bb919e",
  "executable_dependency_digests": [
    {
      "path": "packages/controlled-contract/lib/bounded-diagnostic-projection.mjs",
      "sha256": "1ff4164683c3ed82cc184033d29bd437f9c349aab63036a8a0e6ac5241301e35"
    },
    {
      "path": "packages/controlled-contract/lib/compiled-validator-cache.mjs",
      "sha256": "4615c3745a066497f67eb36b84228d3995250f354911c8f070aa7ef24224a4e4"
    },
    {
      "path": "packages/controlled-contract/lib/deterministic-lexicographic-ordering.mjs",
      "sha256": "1b851826cd19437f44830ee3f3a00464145e75eff411f0114336e2b24cdeae41"
    },
    {
      "path": "packages/controlled-contract/lib/deterministic-projection-primitives.mjs",
      "sha256": "2090a18c5d66ebb84008074ac06a5ae127d04cf061ea7fb826eda25b99d29f05"
    },
    {
      "path": "packages/controlled-contract/lib/equality-normalization-v1.mjs",
      "sha256": "eb2848ae678a33272b331bb7a741b46bdcff2a10882530172e3eabfa3d32dd1a"
    },
    {
      "path": "packages/controlled-contract/lib/exact-binding-runtime-registry.mjs",
      "sha256": "c0aa33a3c1c0ec7977ca6f1df7f607d658fff52c3a33ca482d0d8fbec475b55a"
    },
    {
      "path": "packages/controlled-contract/lib/native-contract-carrier-v1.mjs",
      "sha256": "c4cc2f8b24938471d0dc1f28005b119b6fcec40c207dca5115fc7c6a1e5f34ac"
    },
    {
      "path": "packages/controlled-contract/lib/native-contract-dag.mjs",
      "sha256": "5ae748ea3ea224ca2a0c9aa7320876d114345b3de336f1f91001f03c7427cb23"
    },
    {
      "path": "packages/controlled-contract/lib/native-contract-runtime.mjs",
      "sha256": "a72d06fb070544f9d70a558d0dcecb9e9e35ebaca804bbf4914417d7af89fd5f"
    },
    {
      "path": "packages/controlled-contract/lib/population-semantics-v1.mjs",
      "sha256": "a4b1c4877bc97a5630a4c61bff10af7155d074cb478541e4f214a4ab15110498"
    },
    {
      "path": "packages/controlled-contract/lib/profile-digest.mjs",
      "sha256": "6abee701ee068282b6f37dff287b04d1203186794b7dae3358dc2ca11bd532eb"
    },
    {
      "path": "packages/controlled-contract/lib/projected-contract-graph.mjs",
      "sha256": "f3d4c985f31b74aef5581c6148a0a4e516ce5bf1f6785190a9805dc1c24ab5fe"
    },
    {
      "path": "packages/controlled-contract/lib/resource-policy.mjs",
      "sha256": "0d7e7370a5745f4215ac69260fb6cfefeb048778cec1e4fd43c5da6c71448505"
    },
    {
      "path": "packages/controlled-contract/lib/stable-association-semantics.mjs",
      "sha256": "45df90f5d90670fbd22908302fa0d17884faf392f17c02d2368b338906e4aee7"
    },
    {
      "path": "packages/controlled-contract/lib/stable-contract-schema-v1.mjs",
      "sha256": "d6bb7568dc4bc223dddf24a92ae4cceaa9430a677c25c69d9984da3dcd5e6511"
    },
    {
      "path": "packages/controlled-contract/lib/stable-occurrence-identity.mjs",
      "sha256": "561df8820a08ded0262afca8d9eea9b9b2b8b8ff9aaa67c265d0f8e833456e93"
    },
    {
      "path": "packages/controlled-contract/lib/stable-partition-semantics.mjs",
      "sha256": "373f4ef01f740f4be2e212ed9a74caf7a500cbef77fd985a37e2099653a4a2ac"
    },
    {
      "path": "packages/controlled-contract/lib/stable-relation-semantics.mjs",
      "sha256": "b0c6a10cf8ed6ca1fdad35082a487f5784c3380d1818b3e6d0863580320f068d"
    },
    {
      "path": "packages/controlled-contract/lib/stable-v1-family-validation.mjs",
      "sha256": "89a1186b6b2fd176e8e8db6b12e8160e116882f54f2a1804e2ab5572f3432ab7"
    },
    {
      "path": "packages/controlled-contract/lib/test-proof-provider-registry.mjs",
      "sha256": "f7d2e9bf4e1fc57e8259b37f4e7af4600c34a47f153a33a46f738c576e1789e0"
    },
    {
      "path": "packages/controlled-contract/lib/verification-profile-expanded-semantics.mjs",
      "sha256": "5722474f5e849ad621669c7c8257acc3deb717470537a9c074ac0ebca852a270"
    },
    {
      "path": "packages/controlled-contract/lib/verification-profile-runtime.mjs",
      "sha256": "8bab084a7ac6b2912f271eab05aec523dd9ad2dd6a8b8d134f2aafc8c7b51f63"
    },
    {
      "path": "packages/controlled-contract/lib/verification-profile-schema-v1.mjs",
      "sha256": "ab405a66129332ef99241174ba088c2377f2ac251bc63515ff4845cdc27af227"
    },
    {
      "path": "packages/controlled-contract/lib/verification-profile-semantics.mjs",
      "sha256": "f5ae15527cf08037dba1b6333fa770706e0f26814cc0ed267fbb212d84f68dc4"
    },
    {
      "path": "packages/controlled-contract/lib/verification-profile-v1.mjs",
      "sha256": "512fe162febb3e2685812be2aedc576d952558b92d0120e66d74f4d806f04a21"
    },
    {
      "path": "packages/controlled-contract/lib/vocabulary-v1.mjs",
      "sha256": "bb8f70ca8e70600cb951ec45d54a766e3f012cf7da2e6c1236ea2fe521b13e8a"
    },
    {
      "path": "packages/controlled-contract/schema/controlled-acceptance-contract.v1.schema.json",
      "sha256": "ef4c49974e8169d82db660c1b779e03c0950459f37553ea17d3ee7db07b69caf"
    },
    {
      "path": "packages/controlled-contract/schema/controlled-acceptance-test-proof-definitions.v1.schema.json",
      "sha256": "2a23773f0c36f70993b35d3f5dc5bd61de193ddae26c495671ec787d2915aab9"
    },
    {
      "path": "packages/controlled-contract/schema/controlled-contract-verification-profile-input.v1.schema.json",
      "sha256": "c5b4bead4886e96e5bbc661818cf4f5bf39596304d24a4d987ffb57f6717dfdc"
    },
    {
      "path": "packages/controlled-contract/schema/controlled-contract-verification-profile-result.v1.schema.json",
      "sha256": "33511e8ea57b6a259b5f2f8dd019cae947af9e1cb3e129333e99279da3f80332"
    },
    {
      "path": "packages/controlled-contract/schema/controlled-contract-verification-profile.v1.schema.json",
      "sha256": "3e6048e02a946da43337b196911cfdfaa9d4bf9c3d42dac73d41f60e442f6fb8"
    },
    {
      "path": "packages/controlled-contract/test/support/proof-pack-adequacy-constants.mjs",
      "sha256": "d55f40522f447e2541469ff531375a149f2c78703434bbf00914ac0c19d40a55"
    },
    {
      "path": "packages/controlled-contract/test/support/stable-v1-proof-pack-runtime.mjs",
      "sha256": "0ce9cd57dc3343339cbdfe28f15517754b99e813d1730dec104a2f64661b48fe"
    },
    {
      "path": "packages/controlled-contract/vocabulary/controlled-contract-vocabulary.v1.mjs",
      "sha256": "4e977d3b49644a8d2a6535387860f660280e90e3055d46204e0423e5c1a4bc92"
    }
  ],
  "negative_contract_fixtures": [
    {
      "fixture_id": "reject-claim-each-observation-before-horizon-modalities",
      "path": "packages/controlled-contract/test/certification/profiles/proof.lifecycle.bounded-terminal-stability/2.0.0/negative-fixtures/reject-claim-each-observation-before-horizon-modalities.json",
      "sha256": "25013cc5bcd066f898a3639edad0a00436a44b89830833ddf2e37b71235742a1"
    },
    {
      "fixture_id": "reject-claim-each-observation-before-horizon-proposition-operand-0-role",
      "path": "packages/controlled-contract/test/certification/profiles/proof.lifecycle.bounded-terminal-stability/2.0.0/negative-fixtures/reject-claim-each-observation-before-horizon-proposition-operand-0-role.json",
      "sha256": "a97eeb8be3a16cf67b94c527fa6990451751162f5891e2626240fdf03558fa27"
    },
    {
      "fixture_id": "reject-claim-each-observation-before-horizon-proposition-operator",
      "path": "packages/controlled-contract/test/certification/profiles/proof.lifecycle.bounded-terminal-stability/2.0.0/negative-fixtures/reject-claim-each-observation-before-horizon-proposition-operator.json",
      "sha256": "8369e7cf64e8bbc629f3e58bb523ede300d1b430975016da8e406d41efe68248"
    },
    {
      "fixture_id": "reject-claim-each-observation-reads-entity-modalities",
      "path": "packages/controlled-contract/test/certification/profiles/proof.lifecycle.bounded-terminal-stability/2.0.0/negative-fixtures/reject-claim-each-observation-reads-entity-modalities.json",
      "sha256": "739939b74dd70cc29813a1d78dc8245a8ed1919b4ee89480bfa90b134e5b3700"
    },
    {